{
  "$schema": "https://json-schema.org/draft/2020-12/schema",
  "$id": "https://any-ai-teacher.local/schemas/learning-plan.schema.json",
  "title": "LearningPlanData",
  "type": "object",
  "additionalProperties": false,
  "required": [
    "schemaVersion",
    "planId",
    "planVersion",
    "targetLanguage",
    "uiLanguage",
    "cefrRange",
    "teachingPrinciples",
    "modules"
  ],
  "properties": {
    "schemaVersion": { "type": "string", "const": "1.0.0" },
    "planId": { "type": "string", "minLength": 3 },
    "planVersion": { "type": "string", "minLength": 1 },
    "targetLanguage": { "type": "string", "minLength": 2 },
    "uiLanguage": { "type": "string", "minLength": 2 },
    "cefrRange": {
      "type": "object",
      "additionalProperties": false,
      "required": ["from", "to"],
      "properties": {
        "from": { "type": "string", "minLength": 2 },
        "to": { "type": "string", "minLength": 2 }
      }
    },
    "teachingPrinciples": {
      "type": "array",
      "minItems": 3,
      "items": { "type": "string", "minLength": 3 }
    },
    "planMeta": {
      "type": "object",
      "additionalProperties": false,
      "properties": {
        "structureVersion": { "type": "string", "minLength": 1 },
        "notes": { "type": "string", "minLength": 3 },
        "extensions": {
          "type": "object",
          "additionalProperties": true
        }
      }
    },
    "extensions": {
      "type": "object",
      "additionalProperties": true
    },
    "modules": {
      "type": "array",
      "minItems": 1,
      "items": {
        "type": "object",
        "additionalProperties": false,
        "required": [
          "moduleId",
          "order",
          "cefr",
          "title",
          "durationMin",
          "lessonCadence",
          "prerequisites",
          "lessonObjectives",
          "grammarTargets",
          "verbTargets",
          "vocabThemes",
          "exercisePatterns",
          "funBreakIdeas",
          "completionChecks"
        ],
        "properties": {
          "moduleId": { "type": "string", "minLength": 3 },
          "moduleVersion": { "type": "string", "minLength": 1 },
          "order": { "type": "integer", "minimum": 1 },
          "cefr": { "type": "string", "minLength": 3 },
          "title": { "type": "string", "minLength": 3 },
          "durationMin": {
            "type": "object",
            "additionalProperties": false,
            "required": ["min", "max"],
            "properties": {
              "min": { "type": "integer", "minimum": 12, "maximum": 20 },
              "max": { "type": "integer", "minimum": 15, "maximum": 25 }
            }
          },
          "lessonCadence": {
            "type": "object",
            "additionalProperties": false,
            "required": ["targetLessons", "lessonsPerTopic"],
            "properties": {
              "targetLessons": { "type": "integer", "minimum": 20, "maximum": 60 },
              "lessonsPerTopic": { "type": "integer", "minimum": 2, "maximum": 6 }
            }
          },
          "prerequisites": {
            "type": "array",
            "items": { "type": "string", "minLength": 1 }
          },
          "lessonObjectives": {
            "type": "array",
            "minItems": 2,
            "items": { "type": "string", "minLength": 3 }
          },
          "grammarTargets": {
            "type": "array",
            "minItems": 8,
            "items": {
              "type": "object",
              "additionalProperties": false,
              "required": ["id", "name", "example"],
              "properties": {
                "id": { "type": "string", "minLength": 2 },
                "name": { "type": "string", "minLength": 2 },
                "example": { "type": "string", "minLength": 3 },
                "tags": {
                  "type": "array",
                  "items": { "type": "string", "minLength": 1 }
                },
                "prerequisites": {
                  "type": "array",
                  "items": { "type": "string", "minLength": 1 }
                },
                "extensions": {
                  "type": "object",
                  "additionalProperties": true
                }
              }
            }
          },
          "verbTargets": {
            "type": "array",
            "minItems": 20,
            "items": {
              "type": "object",
              "additionalProperties": false,
              "required": ["infinitive", "present"],
              "properties": {
                "id": { "type": "string", "minLength": 2 },
                "infinitive": { "type": "string", "minLength": 2 },
                "present": {
                  "type": "object",
                  "additionalProperties": false,
                  "required": ["ich", "du", "er_sie_es", "wir", "ihr", "sie_Sie"],
                  "properties": {
                    "ich": { "type": "string", "minLength": 2 },
                    "du": { "type": "string", "minLength": 2 },
                    "er_sie_es": { "type": "string", "minLength": 2 },
                    "wir": { "type": "string", "minLength": 2 },
                    "ihr": { "type": "string", "minLength": 2 },
                    "sie_Sie": { "type": "string", "minLength": 2 }
                  }
                },
                "tags": {
                  "type": "array",
                  "items": { "type": "string", "minLength": 1 }
                },
                "group": { "type": "string", "minLength": 2 },
                "extensions": {
                  "type": "object",
                  "additionalProperties": true
                }
              }
            }
          },
          "vocabThemes": {
            "type": "array",
            "minItems": 10,
            "maxItems": 10,
            "items": { "type": "string", "minLength": 2 }
          },
          "topics": {
            "type": "array",
            "minItems": 1,
            "items": {
              "type": "object",
              "additionalProperties": false,
              "required": ["id", "label"],
              "properties": {
                "id": { "type": "string", "minLength": 2 },
                "label": { "type": "string", "minLength": 2 },
                "aliases": {
                  "type": "array",
                  "items": { "type": "string", "minLength": 1 }
                },
                "tags": {
                  "type": "array",
                  "items": { "type": "string", "minLength": 1 }
                },
                "lessonHint": { "type": "string", "minLength": 2 },
                "extensions": {
                  "type": "object",
                  "additionalProperties": true
                }
              }
            }
          },
          "exercisePatterns": {
            "type": "array",
            "minItems": 2,
            "items": { "type": "string", "minLength": 3 }
          },
          "funBreakIdeas": {
            "type": "array",
            "minItems": 1,
            "items": { "type": "string", "minLength": 3 }
          },
          "completionChecks": {
            "type": "array",
            "minItems": 2,
            "items": { "type": "string", "minLength": 3 }
          },
          "metadata": {
            "type": "object",
            "additionalProperties": true
          },
          "extensions": {
            "type": "object",
            "additionalProperties": true
          }
        }
      }
    }
  }
}
