{
  "schemaVersion": "1.0.0",
  "planId": "de-a1-b1-core",
  "planVersion": "1.0.0",
  "targetLanguage": "German",
  "uiLanguage": "English",
  "cefrRange": {
    "from": "A1.1",
    "to": "B1.2"
  },
  "teachingPrinciples": [
    "Keep each lesson between 15 and 20 minutes and finish with a strict result block.",
    "Focus on practical life and immigration-relevant communication topics.",
    "Correct mistakes immediately, kindly, and with one concise explanation.",
    "Rotate exercises to combine recall, guided production, and free production.",
    "Always end with a mini recap and next-focus hints before the JSON result."
  ],
  "modules": [
    {
      "moduleId": "de-a1-1",
      "order": 1,
      "cefr": "A1.1",
      "title": "Foundations of Connection: Love, Valentine's Day, and warm introductions",
      "durationMin": {
        "min": 15,
        "max": 20
      },
      "prerequisites": [],
      "lessonObjectives": [
        "Introduce yourself warmly in a romantic or friendly Valentine's context.",
        "Use present tense forms of sein and haben to express feelings and preferences.",
        "Build simple sentences about affection, compliments, invitations, and plans."
      ],
      "grammarTargets": [
        {
          "id": "word-order-main",
          "name": "Main clause word order",
          "example": "Ich wohne in Berlin."
        },
        {
          "id": "articles-basic",
          "name": "Definite and indefinite articles",
          "example": "Das ist ein Freund."
        },
        {
          "id": "personal-pronouns",
          "name": "Personal pronouns",
          "example": "Ich sehe dich."
        },
        {
          "id": "yes-no-questions",
          "name": "Yes/no questions",
          "example": "Kommst du heute?"
        },
        {
          "id": "wh-questions-basic",
          "name": "W-questions basics",
          "example": "Wo wohnst du?"
        },
        {
          "id": "negation-nicht-kein",
          "name": "Negation with nicht/kein",
          "example": "Ich habe kein Auto."
        },
        {
          "id": "possessives-basic",
          "name": "Possessive determiners",
          "example": "Das ist meine Tasche."
        },
        {
          "id": "plural-basics",
          "name": "Plural noun patterns",
          "example": "Die Blumen sind rot."
        },
        {
          "id": "verb-position-time",
          "name": "Time expressions in sentence order",
          "example": "Ich gehe heute ins Kino."
        },
        {
          "id": "adjective-predicate",
          "name": "Predicate adjectives",
          "example": "Der Film ist interessant."
        }
      ],
      "verbTargets": [
        {
          "infinitive": "sein",
          "present": {
            "ich": "bin",
            "du": "bist",
            "er_sie_es": "ist",
            "wir": "sind",
            "ihr": "seid",
            "sie_Sie": "sind"
          }
        },
        {
          "infinitive": "haben",
          "present": {
            "ich": "habe",
            "du": "hast",
            "er_sie_es": "hat",
            "wir": "haben",
            "ihr": "habt",
            "sie_Sie": "haben"
          }
        },
        {
          "infinitive": "lieben",
          "present": {
            "ich": "liebe",
            "du": "liebst",
            "er_sie_es": "liebt",
            "wir": "lieben",
            "ihr": "liebt",
            "sie_Sie": "lieben"
          }
        },
        {
          "infinitive": "moegen",
          "present": {
            "ich": "mag",
            "du": "magst",
            "er_sie_es": "mag",
            "wir": "moegen",
            "ihr": "moegt",
            "sie_Sie": "moegen"
          }
        },
        {
          "infinitive": "heissen",
          "present": {
            "ich": "heisse",
            "du": "heisst",
            "er_sie_es": "heisst",
            "wir": "heissen",
            "ihr": "heisst",
            "sie_Sie": "heissen"
          }
        },
        {
          "infinitive": "wohnen",
          "present": {
            "ich": "wohne",
            "du": "wohnst",
            "er_sie_es": "wohnt",
            "wir": "wohnen",
            "ihr": "wohnt",
            "sie_Sie": "wohnen"
          }
        },
        {
          "infinitive": "kommen",
          "present": {
            "ich": "komme",
            "du": "kommst",
            "er_sie_es": "kommt",
            "wir": "kommen",
            "ihr": "kommt",
            "sie_Sie": "kommen"
          }
        },
        {
          "infinitive": "gehen",
          "present": {
            "ich": "gehe",
            "du": "gehst",
            "er_sie_es": "geht",
            "wir": "gehen",
            "ihr": "geht",
            "sie_Sie": "gehen"
          }
        },
        {
          "infinitive": "machen",
          "present": {
            "ich": "mache",
            "du": "machst",
            "er_sie_es": "macht",
            "wir": "machen",
            "ihr": "macht",
            "sie_Sie": "machen"
          }
        },
        {
          "infinitive": "finden",
          "present": {
            "ich": "finde",
            "du": "findest",
            "er_sie_es": "findet",
            "wir": "finden",
            "ihr": "findet",
            "sie_Sie": "finden"
          }
        },
        {
          "infinitive": "suchen",
          "present": {
            "ich": "suche",
            "du": "suchst",
            "er_sie_es": "sucht",
            "wir": "suchen",
            "ihr": "sucht",
            "sie_Sie": "suchen"
          }
        },
        {
          "infinitive": "lernen",
          "present": {
            "ich": "lerne",
            "du": "lernst",
            "er_sie_es": "lernt",
            "wir": "lernen",
            "ihr": "lernt",
            "sie_Sie": "lernen"
          }
        },
        {
          "infinitive": "brauchen",
          "present": {
            "ich": "brauche",
            "du": "brauchst",
            "er_sie_es": "braucht",
            "wir": "brauchen",
            "ihr": "braucht",
            "sie_Sie": "brauchen"
          }
        },
        {
          "infinitive": "kaufen",
          "present": {
            "ich": "kaufe",
            "du": "kaufst",
            "er_sie_es": "kauft",
            "wir": "kaufen",
            "ihr": "kauft",
            "sie_Sie": "kaufen"
          }
        },
        {
          "infinitive": "kochen",
          "present": {
            "ich": "koche",
            "du": "kochst",
            "er_sie_es": "kocht",
            "wir": "kochen",
            "ihr": "kocht",
            "sie_Sie": "kochen"
          }
        },
        {
          "infinitive": "trinken",
          "present": {
            "ich": "trinke",
            "du": "trinkst",
            "er_sie_es": "trinkt",
            "wir": "trinken",
            "ihr": "trinkt",
            "sie_Sie": "trinken"
          }
        },
        {
          "infinitive": "essen",
          "present": {
            "ich": "esse",
            "du": "isst",
            "er_sie_es": "isst",
            "wir": "essen",
            "ihr": "esst",
            "sie_Sie": "essen"
          }
        },
        {
          "infinitive": "treffen",
          "present": {
            "ich": "treffe",
            "du": "triffst",
            "er_sie_es": "trifft",
            "wir": "treffen",
            "ihr": "trefft",
            "sie_Sie": "treffen"
          }
        },
        {
          "infinitive": "warten",
          "present": {
            "ich": "warte",
            "du": "wartest",
            "er_sie_es": "wartet",
            "wir": "warten",
            "ihr": "wartet",
            "sie_Sie": "warten"
          }
        },
        {
          "infinitive": "planen",
          "present": {
            "ich": "plane",
            "du": "planst",
            "er_sie_es": "plant",
            "wir": "planen",
            "ihr": "plant",
            "sie_Sie": "planen"
          }
        }
      ],
      "vocabThemes": [
        "love and valentines day",
        "relationship",
        "friends and dating",
        "introducing yourself",
        "family",
        "supermarket",
        "food and drinks",
        "activities",
        "weekend plans",
        "weather small talk"
      ],
      "exercisePatterns": [
        "Fill in missing verb forms with romantic mini-dialogues.",
        "Choose correct article and adjective in compliment sentences.",
        "Answer invitation and date-planning prompts with new vocabulary."
      ],
      "funBreakIdeas": [
        "Word of the day tied to love and relationships.",
        "Short Valentine's themed tongue twister."
      ],
      "completionChecks": [
        "Learner can produce five correct affection and invitation sentences.",
        "Learner can ask and answer three Valentine's themed personal questions."
      ],
      "lessonCadence": {
        "targetLessons": 20,
        "lessonsPerTopic": 2
      },
      "moduleVersion": "1.0.0",
      "topics": [
        {
          "id": "de-a1-1-love-and-valentines-day",
          "label": "love and valentines day",
          "aliases": [
            "love and valentines day"
          ]
        },
        {
          "id": "de-a1-1-relationship",
          "label": "relationship",
          "aliases": [
            "relationship"
          ]
        },
        {
          "id": "de-a1-1-friends-and-dating",
          "label": "friends and dating",
          "aliases": [
            "friends and dating"
          ]
        },
        {
          "id": "de-a1-1-introducing-yourself",
          "label": "introducing yourself",
          "aliases": [
            "introducing yourself"
          ]
        },
        {
          "id": "de-a1-1-family",
          "label": "family",
          "aliases": [
            "family"
          ]
        },